{
  "assessment_id": "synthetic-article196-unknown-customer-status",
  "transaction_date": "2026-10-08",
  "facts": {
    "supplier_establishment": {"state": "KNOWN", "value": "HU", "evidence_ids": ["synthetic-supplier-fact"]},
    "supplier_fixed_establishment": {"state": "UNKNOWN", "value": null, "evidence_ids": []},
    "customer_taxable_person_status": {"state": "UNKNOWN", "value": null, "evidence_ids": []},
    "customer_establishment": {"state": "KNOWN", "value": "DE", "evidence_ids": ["synthetic-country-fact"]},
    "customer_receiving_fixed_establishment": {"state": "UNKNOWN", "value": null, "evidence_ids": []},
    "customer_vat_id": {"state": "KNOWN", "value": "DE000000000", "evidence_ids": ["synthetic-vat-id-fact"], "verification_state": "VERIFIED"},
    "service_classification": {"state": "KNOWN", "value": "GENERAL_SERVICE", "evidence_ids": ["synthetic-classification-review"]},
    "place_of_supply_rule": {"state": "KNOWN", "value": "eu-vat-services-b2b-general@1", "evidence_ids": ["approved-rule-provenance"]}
  },
  "outcome": "NOT_ASSESSED",
  "uncertainties": ["MISSING_FACT", "HUMAN_ACCOUNTANT_DECISION"],
  "human_review_required": true,
  "notes": "Synthetic fixture demonstrates that a VAT-ID state is a separate fact and does not determine taxable-person status or Article 196 outcome."
}
